{
  "schema_version": 3,
  "product": "heyfood",
  "binary_version": "0.8.0",
  "build": {
    "source_commit": "0000000000000000000000000000000000000000",
    "source_tree": "0000000000000000000000000000000000000000",
    "dirty": true,
    "toolchain": "phase0-contract-fixture",
    "distribution_channel": "development",
    "target": "phase0-contract-fixture",
    "features": [],
    "build_input_digest_sha256": "0000000000000000000000000000000000000000000000000000000000000000"
  },
  "compatibility": {
    "guide_version": 2,
    "mcp_protocol_version": 1,
    "minimum_skill_contract_version": 2,
    "maximum_skill_contract_version": 2,
    "additive_optional_fields": false,
    "bootstrap_command": "heyfood agent compatibility --json --no-input",
    "bootstrap_result_schema": {
      "id": "https://hey.food/schemas/v1/heyfood-agent-compatibility.schema.json",
      "sha256": "8011a2a51300ea6f10d12b24f537e8fa47b28cd48a793f9158f6775154d900d9"
    }
  },
  "automation_surfaces": {
    "one_shot_json": "active",
    "mcp_stdio": "active",
    "tui_automation": "unsupported"
  },
  "native_state_compatibility": {
    "binary_version": "0.8.0",
    "maximum_native_state_version": 3,
    "minimum_managed_writer_version": "0.8.0",
    "native_state_capabilities": [
      "household-account-slot-v1",
      "household-lifecycle-lock-v1",
      "household-migration-guard-v1",
      "household-teardown-journal-v1",
      "household-agent-disclosure-v1",
      "household-agent-proposal-journal-v1",
      "household-agent-reconciliation-v1"
    ],
    "schema_version": 2,
    "declaration_schema": {
      "id": "https://hey.food/schemas/v1/agent-household-native-state.schema.json",
      "sha256": "690c3480c9b4719482063665a49f6d70969ece2eb5e0ee29ee88cc8e1a494403"
    }
  },
  "limits": {
    "manifest_bytes": 1048576,
    "schema_bytes": 1048576,
    "mcp_inbound_frame_bytes": 1048576,
    "mcp_tool_arguments_bytes": 1048576,
    "mcp_structured_result_bytes": 4194304,
    "outstanding_requests": 8,
    "page_records": 100,
    "proposal_lifetime_seconds": 600
  },
  "capabilities": [
    { "id": "household-roster", "status": "active", "contract_version": "v1", "authority": "read_only", "disclosure": "per_subject_roster" },
    { "id": "household-profile", "status": "active", "contract_version": "v1", "authority": "read_only", "disclosure": "per_subject_profile" },
    { "id": "household-lifecycle", "status": "active", "contract_version": "v1", "authority": "prepare_only", "disclosure": "local_status_only" },
    { "id": "household-local-review", "status": "active", "contract_version": "v1", "authority": "human_terminal_only", "disclosure": "local_status_only" }
  ],
  "commands": [
    {
      "path": "agent compatibility",
      "status": "active",
      "audience": "agent_safe",
      "operation_class": "local_read",
      "network": false,
      "product_state_mutation": false,
      "input_schema": null,
      "result_schema": {
        "id": "https://hey.food/schemas/v1/heyfood-agent-compatibility.schema.json",
        "sha256": "8011a2a51300ea6f10d12b24f537e8fa47b28cd48a793f9158f6775154d900d9"
      },
      "retry_class": "safe_read",
      "approval": "none"
    },
    {
      "path": "household show",
      "status": "active",
      "audience": "agent_safe",
      "operation_class": "local_read",
      "network": false,
      "product_state_mutation": false,
      "input_schema": {
        "id": "https://hey.food/schemas/v1/agent-household-read.schema.json",
        "sha256": "b70db3f02dc3c68333bbf79c3ff92c415715d5ce7d07a99af445adefced4e8e2"
      },
      "result_schema": {
        "id": "https://hey.food/schemas/v1/agent-household-read.schema.json",
        "sha256": "b70db3f02dc3c68333bbf79c3ff92c415715d5ce7d07a99af445adefced4e8e2"
      },
      "retry_class": "safe_read",
      "approval": "none"
    },
    {
      "path": "household member",
      "status": "active",
      "audience": "agent_safe",
      "operation_class": "local_read",
      "network": false,
      "product_state_mutation": false,
      "input_schema": {
        "id": "https://hey.food/schemas/v1/agent-household-read.schema.json",
        "sha256": "b70db3f02dc3c68333bbf79c3ff92c415715d5ce7d07a99af445adefced4e8e2"
      },
      "result_schema": {
        "id": "https://hey.food/schemas/v1/agent-household-read.schema.json",
        "sha256": "b70db3f02dc3c68333bbf79c3ff92c415715d5ce7d07a99af445adefced4e8e2"
      },
      "retry_class": "safe_read",
      "approval": "none"
    }
  ],
  "mcp_inventory": {
    "protocol_version": 1,
    "tool_set_version": 2,
    "tools": [
      { "name": "heyfood_get_manifest", "status": "active", "operation_class": "local_read", "authority": "read_only", "approval": "none", "input_schema": { "id": "urn:heyfood:mcp:v1:get-manifest:input", "sha256": "99334726611ccf58a148b0814696bfa6fe08c1b2d027e946beccf5a74331c9aa" }, "result_schema": { "id": "urn:heyfood:mcp:v1:get-manifest:result", "sha256": "3e56ca65de2344f97641314242e6a81695de934351aeb00d39e46ef29ea8451c" }, "read_only_hint": true, "destructive_hint": false, "idempotent_hint": true },
      { "name": "heyfood_get_status", "status": "active", "operation_class": "local_read", "authority": "read_only", "approval": "none", "input_schema": { "id": "urn:heyfood:mcp:v1:get-status:input", "sha256": "99334726611ccf58a148b0814696bfa6fe08c1b2d027e946beccf5a74331c9aa" }, "result_schema": { "id": "urn:heyfood:mcp:v1:get-status:result", "sha256": "b211f6a5ead5ce01024f917b5a9dbd7a4478bc09c86727b439e6a435dfb3558d" }, "read_only_hint": false, "destructive_hint": false, "idempotent_hint": true },
      { "name": "heyfood_get_capabilities", "status": "active", "operation_class": "local_read", "authority": "read_only", "approval": "none", "input_schema": { "id": "urn:heyfood:mcp:v1:get-capabilities:input", "sha256": "99334726611ccf58a148b0814696bfa6fe08c1b2d027e946beccf5a74331c9aa" }, "result_schema": { "id": "urn:heyfood:mcp:v1:get-capabilities:result", "sha256": "5e9d9e43208aa8a5fc529d86b015652fe113ea1031c7f88fad3198e404d5b510" }, "read_only_hint": false, "destructive_hint": false, "idempotent_hint": true },
      { "name": "heyfood_get_grocery_list", "status": "active", "operation_class": "local_read", "authority": "read_only", "approval": "none", "input_schema": { "id": "urn:heyfood:mcp:v1:get-grocery-list:input", "sha256": "5125c1a7d77fb5a748f1008689b52612a94bf6d3c64264d15c0a6edb7f6e596b" }, "result_schema": { "id": "urn:heyfood:mcp:v1:get-grocery-list:result", "sha256": "e2198ddbc3fd192b19b45509ed67224e7caee4462c78b623eb5fd195c1d0d81f" }, "read_only_hint": false, "destructive_hint": false, "idempotent_hint": true },
      { "name": "heyfood_get_grocery_exclusions", "status": "active", "operation_class": "local_read", "authority": "read_only", "approval": "none", "input_schema": { "id": "urn:heyfood:mcp:v1:get-grocery-exclusions:input", "sha256": "5125c1a7d77fb5a748f1008689b52612a94bf6d3c64264d15c0a6edb7f6e596b" }, "result_schema": { "id": "urn:heyfood:mcp:v1:get-grocery-exclusions:result", "sha256": "2ff5349b4c6e5641c6617f6d9484014dc361344e3f8a1a61682f28053387ca0b" }, "read_only_hint": false, "destructive_hint": false, "idempotent_hint": true },
      { "name": "heyfood_list_menu_watches", "status": "active", "operation_class": "local_read", "authority": "read_only", "approval": "none", "input_schema": { "id": "urn:heyfood:mcp:v1:list-menu-watches:input", "sha256": "5125c1a7d77fb5a748f1008689b52612a94bf6d3c64264d15c0a6edb7f6e596b" }, "result_schema": { "id": "urn:heyfood:mcp:v1:list-menu-watches:result", "sha256": "a610b384b5a3a95acf59a5c0912ccf48853bb4923717790083b7514c1c91de93" }, "read_only_hint": false, "destructive_hint": false, "idempotent_hint": true },
      { "name": "heyfood_get_household_context", "status": "active", "operation_class": "local_read", "authority": "read_only", "approval": "none", "input_schema": { "id": "https://hey.food/schemas/v1/agent-household-read.schema.json", "sha256": "b70db3f02dc3c68333bbf79c3ff92c415715d5ce7d07a99af445adefced4e8e2" }, "result_schema": { "id": "https://hey.food/schemas/v1/agent-household-read.schema.json", "sha256": "b70db3f02dc3c68333bbf79c3ff92c415715d5ce7d07a99af445adefced4e8e2" }, "read_only_hint": true, "destructive_hint": false, "idempotent_hint": true },
      { "name": "heyfood_get_household_member", "status": "active", "operation_class": "local_read", "authority": "read_only", "approval": "none", "input_schema": { "id": "https://hey.food/schemas/v1/agent-household-read.schema.json", "sha256": "b70db3f02dc3c68333bbf79c3ff92c415715d5ce7d07a99af445adefced4e8e2" }, "result_schema": { "id": "https://hey.food/schemas/v1/agent-household-read.schema.json", "sha256": "b70db3f02dc3c68333bbf79c3ff92c415715d5ce7d07a99af445adefced4e8e2" }, "read_only_hint": true, "destructive_hint": false, "idempotent_hint": true },
      { "name": "heyfood_prepare_household_change", "status": "active", "operation_class": "prepare", "authority": "prepare_only", "approval": "attached_heyfood_tui", "input_schema": { "id": "https://hey.food/schemas/v1/agent-household-action.schema.json", "sha256": "e8f717da7b16102483c72fa79f001487284c7fca939867c6dd869ec9376550b2" }, "result_schema": { "id": "https://hey.food/schemas/v1/agent-household-proposal-presentation.schema.json", "sha256": "8d308f78910d3f822bd14f3bf3da3b10ff08c66399277e0bdd973695e8c8b25a" }, "read_only_hint": false, "destructive_hint": false, "idempotent_hint": false },